word,number
https secure us imrworldwide com 443,2
http secure us imrworldwide com,2
secure us imrworldwide com 443,1
imrworldwide,1
view domain,1
ugo player free flash games and animation,1
here,1
secure us imrworldwide com,1
eat well enjoy great healthy food,1
http www secure us imrworldwide com,1
https secure us imrworldwide com,1
view the link as it exists on the live site,1
404 not found secure us imrworldwide com,1
http secure us imrworldwide com 443,1
ugo player free games and animation,1
